{
  "schema": "intyy.safety_report/1.0",
  "generated_at": "2026-10-02T15:21:50.673Z",
  "success": true,
  "totals": {
    "tests": 422,
    "passed": 422,
    "failed": 0,
    "skipped": 0,
    "expected_failures": 1
  },
  "files": [
    {
      "file": "tests/unit/evidence/label-leak.test.ts",
      "status": "passed",
      "tests": [
        {
          "name": "G: publish and the label rule (§9.7) a planted raw labelled cell gives unmasked_label with path and line, no value, no write",
          "status": "passed"
        },
        {
          "name": "G: publish and the label rule (§9.7) a fixture's a11y.yaml is checked too",
          "status": "passed"
        },
        {
          "name": "G: publish and the label rule (§9.7) a file that is not a snapshot is not checked",
          "status": "passed"
        },
        {
          "name": "G: publish and the label rule (§9.7) the same snapshot, masked, publishes",
          "status": "passed"
        },
        {
          "name": "G: publish and the label rule (§9.7) the output of maskA11y on a legacy page publishes",
          "status": "passed"
        },
        {
          "name": "G: publish and the label rule (§9.7) without redaction rules the check does not run",
          "status": "passed"
        }
      ]
    },
    {
      "file": "tests/unit/evidence/markers.test.ts",
      "status": "passed",
      "tests": [
        {
          "name": "canaryMarkers values hold the canary members and every bound secret value",
          "status": "passed"
        },
        {
          "name": "canaryMarkers a binding with no value is named in `missing`, and adds no marker",
          "status": "passed"
        }
      ]
    },
    {
      "file": "tests/unit/evidence/models.test.ts",
      "status": "passed",
      "tests": [
        {
          "name": "PublishManifest a good manifest parses",
          "status": "passed"
        },
        {
          "name": "PublishManifest an unknown key is rejected, at the top and inside an item",
          "status": "passed"
        },
        {
          "name": "PublishManifest a wrong schema name, a bad hash, and a bad item kind are rejected",
          "status": "passed"
        },
        {
          "name": "SafetyReport a good report parses",
          "status": "passed"
        },
        {
          "name": "SafetyReport an unknown key is rejected, at the top, in totals, and in a test",
          "status": "passed"
        },
        {
          "name": "SafetyReport a wrong schema name or status is rejected",
          "status": "passed"
        }
      ]
    },
    {
      "file": "tests/unit/evidence/publish-key.test.ts",
      "status": "passed",
      "tests": [
        {
          "name": "publishing a key's trust snapshot copies the history, the record, and the plan and report of each batch the history names",
          "status": "passed"
        },
        {
          "name": "publishing a key's trust snapshot the manifest lists the key as an item of kind key, and verify finds the evidence clean",
          "status": "passed"
        },
        {
          "name": "publishing a key's trust snapshot verify finds a snapshot file that went missing",
          "status": "passed"
        },
        {
          "name": "publishing a key's trust snapshot a history that names a batch the source does not hold is link_missing, and nothing is written",
          "status": "passed"
        },
        {
          "name": "publishing a key's trust snapshot a key with no score files is not_found",
          "status": "passed"
        },
        {
          "name": "publishing a key's trust snapshot a key of another tenant is not_found",
          "status": "passed"
        }
      ]
    },
    {
      "file": "tests/unit/evidence/publish.test.ts",
      "status": "passed",
      "tests": [
        {
          "name": "a clean publish a run copies its folder, its batch's plan and report, and the artifacts it used",
          "status": "passed"
        },
        {
          "name": "a clean publish the manifest names every item, who and when, and a hash for every copied file",
          "status": "passed"
        },
        {
          "name": "a clean publish each artifact copy matches the seal hash the artifact index records",
          "status": "passed"
        },
        {
          "name": "a canary hit refuses the whole publish in a run file",
          "status": "passed"
        },
        {
          "name": "a canary hit refuses the whole publish in a run file, as the second marker (a bound secret value)",
          "status": "passed"
        },
        {
          "name": "a canary hit refuses the whole publish in a base64 form",
          "status": "passed"
        },
        {
          "name": "a canary hit refuses the whole publish in a sealed artifact",
          "status": "passed"
        },
        {
          "name": "a canary hit refuses the whole publish in a batch file",
          "status": "passed"
        },
        {
          "name": "refusals write nothing hash_mismatch: a listed file changed after the run wrote it",
          "status": "passed"
        },
        {
          "name": "refusals write nothing not_indexed: the run has no line in the tenant index",
          "status": "passed"
        },
        {
          "name": "refusals write nothing index_mismatch: the index says another status than run.json",
          "status": "passed"
        },
        {
          "name": "refusals write nothing link_missing: a run names a parent that is not in the evidence",
          "status": "passed"
        },
        {
          "name": "refusals write nothing link_missing: a run names a batch that is not in the evidence",
          "status": "passed"
        },
        {
          "name": "refusals write nothing link_missing: the run to publish is not in the evidence at all",
          "status": "passed"
        },
        {
          "name": "refusals write nothing artifact_mismatch: an artifact changed after sealing",
          "status": "passed"
        },
        {
          "name": "refusals write nothing artifact_mismatch: an artifact has no line in the artifact index",
          "status": "passed"
        },
        {
          "name": "refusals write nothing forbidden_file: a run folder holds trace.zip",
          "status": "passed"
        },
        {
          "name": "refusals write nothing forbidden_file: a run folder holds session.har",
          "status": "passed"
        },
        {
          "name": "refusals write nothing forbidden_file: a run folder holds cookies.json",
          "status": "passed"
        },
        {
          "name": "refusals write nothing forbidden_file: a run folder holds storage_state.json",
          "status": "passed"
        },
        {
          "name": "refusals write nothing forbidden_file: a run folder holds traces/page.bin",
          "status": "passed"
        },
        {
          "name": "refusals write nothing forbidden_file: a run folder holds video/run.webm",
          "status": "passed"
        },
        {
          "name": "refusals write nothing manifest_invalid: an existing manifest does not parse, and is left alone",
          "status": "passed"
        },
        {
          "name": "refusals write nothing write_failed: the destination cannot write, and no manifest is written",
          "status": "passed"
        },
        {
          "name": "links resolve (section 9 §6.6, check 3) a child run also publishes its parent",
          "status": "passed"
        },
        {
          "name": "links resolve (section 9 §6.6, check 3) a parent run also publishes its children",
          "status": "passed"
        },
        {
          "name": "links resolve (section 9 §6.6, check 3) a run in a batch also publishes the batch's plan and report",
          "status": "passed"
        },
        {
          "name": "a batch target copies plan.json, report.json, and only the runs whose verdict is not pass",
          "status": "passed"
        },
        {
          "name": "a batch target --with-runs all copies every run of the batch",
          "status": "passed"
        },
        {
          "name": "size and repeat publishes past 60 MB it warns and still publishes",
          "status": "passed"
        },
        {
          "name": "size and repeat publishes a second publish adds to the manifest and moves `at`",
          "status": "passed"
        },
        {
          "name": "verifyEvidence a fresh publish has no problems",
          "status": "passed"
        },
        {
          "name": "verifyEvidence a changed file is one problem, naming the file",
          "status": "passed"
        },
        {
          "name": "verifyEvidence a deleted file is a problem",
          "status": "passed"
        },
        {
          "name": "verifyEvidence a file the manifest does not list is a problem",
          "status": "passed"
        },
        {
          "name": "verifyEvidence a forbidden file name is a problem",
          "status": "passed"
        },
        {
          "name": "verifyEvidence a canary in README.md is a problem that does not print the value",
          "status": "passed"
        },
        {
          "name": "verifyEvidence a run whose parent is not published is a problem",
          "status": "passed"
        },
        {
          "name": "verifyEvidence no manifest is a failure, not a clean result",
          "status": "passed"
        }
      ]
    },
    {
      "file": "tests/unit/evidence/safety-report.test.ts",
      "status": "passed",
      "tests": [
        {
          "name": "buildSafetyReport marks only the known-limit test, and the totals add up",
          "status": "passed"
        },
        {
          "name": "buildSafetyReport a failed test makes success false",
          "status": "passed"
        },
        {